序号,权重,自我肯定语,是否短断句,生产者,合集,合集理由,感情状况,感情状况理由,最近的感觉,什么让你有这种感觉,最近的感觉理由,场景,子场景,用户需求,心理作用机制与功能,句子级别,备注
3668,1,我的内心充满爱，随时准备付出。,是,0222-好句产出,"['自信', '治愈之旅', '成为英雄']",这句自我肯定语中'我的内心充满爱，随时准备付出'体现了对自我的肯定和爱的准备，从这个角度来说，它适用于'自信'和'治愈之旅'。'追求仁爱'的场景和子场景让我觉得这句话更符合'成为英雄'这一标签，因为它涉及到内在的爱情和给予他人的准备，这体现了一种英雄的品质。'情感疗愈'主要涉及情感修复和亲密关系的语义，而这句话更多的倾向于个人内在的爱，所以不包含。'平和心境'主要涉及情绪调节和内安宁，虽然这句话有一定的正向情感，但不太涉及情绪调节或对现状的满足感，所以不包括。'人际交往'和'自我关怀'虽然可能有关联，但这句话更多强调的是个人的内在状态，并未直接提及与他人互动或者爱自己的概念，所以不包括。'个人成长'可能与内在的给予与付出有关，但是这句话强调的更多的是一种个人的品质而不是具体成长或提升的过程，因此不包含。,"['正在恋爱', '单身但准备好了开始新的恋情']","不放'最近刚分手', '处在一段艰难的亲密关系中'原因为这个自我肯定语强调内心的爱和付出，与刚经历分手或处在困难关系中的情感状态不相符；不放'快乐地单身着', '有点辛苦的暗恋'原因为这两者更多关注个体自身的状态而非立即的付出，与此自我肯定语的方向不一致。","['很好', '开心']","['感情', '自己']",自我肯定语中提到的“内心充满爱”及“随时准备付出”是一种积极和自信的状态，符合“很好”和“开心”的情感特征。同时，这种肯定语涉及的是对感情和个人内心状态的认识和自我肯定，因此与“感情”和“自己”相关。而“家庭”、“健康”、“工作”、“学业”并不是该句所反映的情绪指向，因此不放这些标签。,个人追求,追求仁爱,,,,
2061,1,在保护自己的同时，我学会了如何与世界对话。,否,上轮回流,"['自信', '人际交往', '个人成长']",这句自我肯定语展现了在保护自己的同时与外界沟通的能力，符合自信和人际交往的特点。同时，学习与世界对话也是一种个人成长的表现。情感疗愈、平和心境和治愈之旅侧重于内心疗愈和情感修复，与这句话强调的向外交流的特点不太匹配。自我关怀和成为英雄在这句话中不太明显。,"['正在恋爱', '处在一段艰难的亲密关系中', '单身但准备好了开始新的恋情', '有点辛苦的暗恋']",这句自我肯定语包含两个部分，一是保护自己，二是学与世界对话。快乐地单身着的标签没有被选择，因为内容并没提及享受独处或者独立自主方面的内容，更侧重个人与外界的互动。最近刚分手的标签没有被选择，因为这句话并不代表情感失落或过去关系的释怀，更多是表达个人能力的成长和社交方面的进步。,"['很好', '一般']",['自己'],不放[开心]的理由是句子并不表达强烈的成就感或力量感；不放[不好]和[糟糕]因为句子传递的是积极的自我肯定和成长的信息；不放[家庭]、[朋友]、[工作]、[健康]、[感情]和[学业]的理由是因为句子中没有明确提及这些因素。,,,,,,
1817,1,我可以无畏地注视和理解那些痛苦的回忆。,#VALUE!,0203-2,"['自信', '成为英雄']",这条自我肯定语强调了面对和理解痛苦回忆的勇气，与'自信'和'成为英雄'两个标签最为贴合。'情感疗愈'和'治愈之旅'虽然也与个人成长和内在改变有关，但这条肯定语更强调勇气和自信，而不是疗愈过程本身。'平和心境'和'自我关怀'则与这条肯定语倡导的勇敢面对负面情绪的语境不太吻合。'人际交往'和'个人成长'这两个标签虽然包含广泛的积极特质和行为，但这条肯定语并没有直接涉及到人际交往或个人能力的明显提升。,"['最近刚分手', '处在一段艰难的亲密关系中', '有点辛苦的暗恋']",“我可以无畏地注视和理解那些痛苦的回忆”这句话更倾向于对痛苦记忆的正面面对和认知重构，因此它更适合曾经历过情感挫折，如'最近刚分手'，需要疗愈和缓解内心不安的用户；或者是在'处在一段艰难的亲密关系中'，需要唤醒勇气去勇敢面对和解决问题的用户；以及在'有点辛苦的暗恋'中，需要鼓励和勇气去争取爱情的用户。而'正在恋爱'和'快乐地单身着'的用户当前的心理状态和这句话的适配度较低。,"['不好', '糟糕', '开心', '很好']",['自己'],1级句子倾向于不好和糟糕，而2级句子更趋向于开心和很好。这个自我肯定语强调了唤醒勇气和增强自信，适用于需要心灵安慰（不好）和情绪低落（糟糕）的用户，也适用于寻求积极情感（开心和很好）。此外，“自我肯定语”的情景说明它与提升个人内在特质（自己）相关，因此没有选择其他的感情状态相关因素标签，如家庭、朋友、工作、健康、感情、学业。,内在特质,唤醒勇气,提醒自己是个勇敢的人,认知重构-增强自信,2.0,
563,1,我每一天都在向目标靠近。,#VALUE!,0203-3,"['自信', '个人成长']",该自我肯定语与个人目标及成长相关，重点在于个人向目标靠近的积极行动，对情感疗愈、平和心境、治愈之旅、人际交往、自我关怀和成为英雄的适配度较低。情感疗愈和治愈之旅更偏向情感处理和内心和谐，而这句话强调的是积极的个人成长和自我肯定。人际交往和成为英雄也未被直接涉及，所以不选择这些标签。,"['正在恋爱', '快乐地单身着', '单身但准备好了开始新的恋情']",不放'处在一段艰难的亲密关系中'和'有点辛苦的暗恋'是因为这句话更多强调个人追求成就和自我提升，而与个人的情感关系状态、恋情状态关系不直接；不放'最近刚分手'是因为这句话强调前进和趋近目标，对于刚分手正在疗愈和释怀的用户来说不符，更关注从过去关系恢复。,"['很好', '开心']","['工作', '自己']",这句话具有积极向上的语义，体现了向目标靠近的自信和积极情绪，所以适合推送给感觉【开心】和【很好】的用户。同时因为是个人追求的场景，也不涉及家庭、朋友、健康、感情和学业等其他因素，所以选择剩下的【工作】和【自己】。,个人追求,追求梦想,明确梦想实现的路径与优先级,认知重构-目标具象化,2.0,
2770,1,我的心像溪水流过砂石，过滤掉忧伤，寻得宁静。,否,上轮回流,"['情感疗愈', '平和心境', '治愈之旅']",这个自我肯定语强调了内心的过滤掉忧伤和寻得宁静，因此适合情感疗愈、平和心境和治愈之旅这三个标签。不适用于'自信'标签，因为该语句并未表现自我肯定和力量感；不适合'人际交往'标签，因为语句中的主体是内心而非与他人的互动；不适合'自我关怀'标签，因为这里强调的是内在心理状态而不是关怀自己的身心健康或生活平衡；不适合'个人成长'标签，因为这句话并没有涉及到事业发展或学习创造；不适合'成为英雄'标签，因为该语句没有体现出勇敢行动、宽恕他人或追求理想等特征。,"['最近刚分手', '快乐地单身着']",不放'正在恋爱'和'处在一段艰难的亲密关系中'的理由是这句自我肯定语含有过滤忧伤和寻找宁静的含义，这与'正在恋爱'中的积极情感不符。不放'处在一段艰难的亲密关系中'的理由是它并不涉及个人成长或成为英雄的含义，而是涉及情感疗愈和放下，所以这个标签不符合情境。不放'单身但准备好了开始新的恋情'的理由是因为语句含有的忧伤过滤和宁静寻找可能与积极期待新恋情的情感稍微不一致。不放'有点辛苦的暗恋'的理由是这句话更多关于个人内省和疗愈，与人际交往或勇气的主题不完全契合。,"['不好', '糟糕']","['健康', '自己']",这句话适合不好和糟糕的情感状态。根据句子内容，有'过滤掉忧伤'和'寻得宁静'等描述，可以推断出用户的心情不好和糟糕。至于什么让你有这种感觉的因素，句子中没有明确提到家庭或感情，但有'过滤忧伤'的描述，可以联想到自身遭遇的情绪困扰，因此选择健康和自己的因素。,,,,,,
3218,1,我会找到与我一同追求正确方法的伙伴。,#VALUE!,阿寜寜,['人际交往'],,"['快乐地单身着', '单身但准备好了开始新的恋情']",,['很好'],['朋友'],,,,,,,
3149,2,我的爱越爱越有，越给越多。,是,切尔西,"['成为英雄', '情感疗愈']",,"['正在恋爱', '单身但准备好了开始新的恋情']",,"['开心', '很好']",['感情'],,,,,,,
1587,1,我的真实是我最珍贵的财富。,#VALUE!,0203-2,"['情感疗愈', '自信', '平和心境']",不放'治愈之旅'因为该肯定语主要涉及减轻紧张情绪而非自我接纳或内在疗愈；不放'人际交往'因为该肯定语是关于个人的真实性和面试前的自我感觉，与人际交往关系不大；不放'自我关怀'因为该肯定语更关注真实性和自我价值，而非生活习惯或身心健康；不放'个人成长'因为面试前的肯定主要是情感层面的安抚，并非特定的能力或技能提升；不放'成为英雄'因为该语境下的英雄主义不太适用。,"['正在恋爱', '快乐地单身着', '单身但准备好了开始新的恋情']",这句话 '我的真实是我最珍贵的财富' 体现了自信和自我价值的认可，适用于'正在恋爱'的人因为他们需要表现出真实一面以维持健康的亲密关系；也适用于'快乐地单身着'和'单身但准备好了开始新的恋情'的用户，因为在单身或者准备开始新恋情的过程中，维持一个健康的自我形象和真实性是非常重要的。不在'最近刚分手'的分类中，因为这个场景更多地跟情感失落相关，而不是直接涉及面试场景和应对紧张，尽管真实性在任何关系形态中都很重要，但它不直接对应于'最近刚分手'状态下的用户需求。不在'处在一段艰难的亲密关系中'的分类中，尽管这类用户可能需要提升自信去面对关系中的挑战，但这个自我肯定语更倾向于个人层面和职场环境中的应用。不在'有点辛苦的暗恋'中，因为这个情境下用户可能更多地需要关于勇气和人际关系的句子，而不是职场或面试场景下的信心增强。,['不好'],"['自己', '工作']",该自我肯定语提供了情感安抚和目标平和化的功能，对于面试前紧张情绪显著的用户较为适用，因此适合'不好'群体。对于'开心'和'很好'群体，由于情绪已经较为积极，该自我肯定语对他们的帮助有限，不太适合。'糟糕'群体可能已经处于情感低落状态，而该肯定语并没有直接针对强烈的情感低落问题，所以也不是特别适合。从句子内容看，该肯定语强调的是真实自我的价值，这更多与个人的自我认知和内在观念相关，因此选择了'自己'；同时由于目标是减轻面试前的紧张情绪，与求职、工作的压力有一定关联，所以也适合'工作'群体。'家庭'、'健康'、'感情'、'学业'相关性不大，所以没有选择。,应对挑战,面试,设定有关面试的更平和的目标，减轻面试前的紧张情绪,情感安抚-目标平和化,1.0,
2176,1,我所经历的痛苦将成为明天的养料。,#VALUE!,上轮回流,"['自信', '个人成长', '成为英雄']",该自我肯定语与'情感疗愈'和'平和心境'标签不太相关，因为句子没有涉及情感修复、亲密关系、内心安宁或对现状的满足感。与'治愈之旅'、'人际交往'和'自我关怀'标签也不是非常吻合，句子主要表达了自我肯定、力量感和面临挑战的勇气，没有直接提到自我接纳、自我宽慰、内心疗愈、与他人互动或身心健康。,"['正在恋爱', '处在一段艰难的亲密关系中', '快乐地单身着', '单身但准备好了开始新的恋情', '最近刚分手']",该自我肯定语没有特别指明是关于爱情或亲密关系的疲惫，所以它是通用的，可以根据用户心态影响不同感情状态的人。对于处于各种感情状态的人们，这句话都可以适量地激发积极情绪，强调将自己的经历（无论好坏）转化为前进的动力。因此，我选择不过滤任何标签。,"['一般', '不好', '糟糕']","['自己', '健康']",语句表达了从一个不佳状态（疲惫）转向积极（成为燃料）的情感变化，因此'一般'和'不好'都适合。提到了疲惫，暗示了可能存在健康相关的问题，'健康'和'自己'标签因此适合。'开心'和'很好'不适合，因为语句没有表明正面情绪或者满足感。'工作'、'家庭'、'感情'、'学业'并未在语句中体现，所以不选择这些标签。,,,,,,
974,2,我享受每天的小成就感。,#VALUE!,0203-3,"['自信', '平和心境', '个人成长']",不包含'情感疗愈'，因为这句话虽然带有正面情感，但没有提及情感修复或建立关系的内容；不包含'治愈之旅'，因为这句话没有直接涉及自我接纳或内在疗愈；不包含'人际交往'和'成为英雄'，因为这句话主要关注的是个人的小成就和作息调整，与这两个标签没有直接关联。不包含'自我关怀'，因为这句话没有涉及到对自我爱护、身心健康方面的具体描述，而是更多侧重于个人成就的享受和作息调整的目标设定，与自关怀界定有些偏差。,"['正在恋爱', '快乐地单身着', '单身但准备好了开始新的恋情']",由于自我肯定语是关于自我满足和每天的小成就，它适合那些在积极情绪状态下的用户。因此，'正在恋爱'与此相符，因为恋爱中的人可能会感到成就感。'快乐地单身着'也适合，因为它强调自我成就和独立性。'单身但准备好了开始新的恋情'适合是因为目标的平和化可以帮助建立自信心，对新人也抱有积极态度。'有点辛苦的暗恋'不适合，因为没有涉及情感困扰和挣扎，只是个人成就的积极肯定。'最近刚分手'和'处在一段艰难的亲密关系中'都不适合，因为他们的情感状态与句子中的积极自我肯定不相符，这个句子并未直接涉及情感安抚或解决关系问题。,"['很好', '开心']","['健康', '自己']",自我肯定语句具有积极情感倾向，适用于'开心'和'很好'的状态。同时句子与身体健康相关，符合当前场景。,身体健康,作息,设定逐步调整作息的渐进式目标,情感安抚-目标平和化,1.0,
4128,3,虽然我走的很慢，但我的确在前进。,是,Colourful.-0315,,,,,,,,,,,,,
2632,1,我的故事正在上演，每一个章节都不可忽视。,否,上轮回流,"['自信', '个人成长']",这句话更加聚焦于个人的故事和成长，体现了自信和对个人发展历程的重视。'每一个章节都不可忽视'强调了个人经历和成长的连续性和重要性，因此'情感疗愈'和'治愈之旅'似乎不太贴切，因为它们更多的是在某段情感创伤后寻求复原的过程。'平和心境'和'自我关怀'也不完全贴切，因为这句话更多表达的是一种积极向前的肯定，而没有表达出很强的内心平和或自我关怀的意味。'人际交往'和'成为英雄'同样不太适合，因为这句话并未涉及与他人的关系或展示英雄特质。,"['正在恋爱', '快乐地单身着', '单身但准备好了开始新的恋情']",不放处在一段艰难的亲密关系中标签的理由：这句话强调个体生活的故事性和完整性，没有表达出关系中的矛盾或挣扎。不放最近刚分手标签的理由：这句话强调的是一个正在进行中的故事，而这个阶段并不特别关联于刚刚结束的过去关系。不放有点辛苦的暗恋标签的理由：此自我肯定语没有涉及到暗恋中的情感纠结或对人际交往的需求，也未提及勇气或关系中的主动，而是关注于个人生活故事的整体性。,"['一般', '很好']",['自己'],这个句子表示用户的故事在进行中，每个章节都很重要，表达了一种积极的态度和自我肯定，适合心情很好的用户。句子没有提到家庭、健康、工作等方面，而是更多关于个人的积极心态，所以选择'一般'和'很好'标签，'自己'作为影响因素。没有选择'开心'是因为句子没有直接表达自信或成就感，也没有选择'不好'和'糟糕'是因为句子表达了积极情绪。,,,,,,
1070,1,我的健康是我幸福的源泉。,#VALUE!,0203-3,['自我关怀'],不放'情感疗愈'，'平和心境'，'人际交往'，'治愈之旅'，'成为英雄'的理由：此自我肯定语强调的是健康对个人幸福的重要性，这主要与个体的自我认同和自我成长相关，关联自信和自我关怀标签。而情感疗愈、平和心境通常涉及情绪调节和内心安宁，与健康带来的幸福不完全吻合。人际交往关注与他人的关系，而自我肯定语聚焦的是个人健康和幸福。治愈之旅涉及内在疗愈，而此处强调的是通过身体健康达成幸福，并非侧重于疗愈过程。成为英雄与个体的勇敢行为相关，而无关乎个人健康和个人认同问题。,"['正在恋爱', '快乐地单身着', '单身但准备好了开始新的恋情']",不放'处在一段艰难的亲密关系中'的原因是，该自我肯定语聚焦于健康和自我价值，并不一定针对关系中的矛盾和挣扎。不放'最近刚分手'的原因是，虽然自信的提升有利于疗愈过程，但该自我肯定语的主要场景是应对演讲挑战，相对来说更贴合积极的生活态度而非情感疗愈。不放'有点辛苦的暗恋'的原因是，该自我肯定语强调自我价值，而非人际交往和情感表白。,"['很好', '开心']","['健康', '自己']",不放'不好'和'糟糕'标签的理由是，句子“我的健康是我幸福的源泉”带有明显的积极和自信情感，表达了健康对自身的积极影响，与'开心'和'很好'的情感状态相匹配。不放'家庭'、'朋友'、'工作'、'感情'、'学业'标签的理由是，句子中并未提及这些因素。,应对挑战,演讲,通过持续的身体活动提高自我认同，对自己的外貌和健康状况感到满意,行为驱动-目标达成,2.0,
2511,1,我固然在乎他人，但更在乎自己心中的声音。,是,上轮回流,"['自信', '自我关怀', '个人成长']",'情感疗愈'和'治愈之旅'未被选中，因为这个肯定语更多的是在强调自己内心的声音的重要性，并且不太涉及情感修复或者内在疗愈。'平和心境'未被选中，因为这个肯定语中没有明确提及情绪调节或内心安宁。'人际交往'未被选中，因为该肯定语重点在于关注自己，并没有提到与他人的交往或互动。'成为英雄'不适用，因为这个肯定语中没有涉及勇敢行动或者宽恕他人等元素。,"['正在恋爱', '快乐地单身着', '单身但准备好了开始新的恋情']",不放'最近刚分手'和'有点辛苦的暗恋'的理由是，该自我肯定语强调的是倾听自己内心的声音，而不是特别关乎恋爱关系的状态。而'处在一段艰难的亲密关系中'的用户可能会受到外界因素影响较多，重点不在自我肯定上，所以不放这个标签。,"['一般', '不好']","['家人', '自己']",该自我肯定语提供了自我价值感和自我关怀，适合一般及不好的情绪状态。开心和很好情绪状态下的人群，可能不需要这种强调自我重要性的提示。句子中没有提及家庭外的其他特定因素，但'他人'可能包括家庭或朋友，因此将家庭包括在内。,,,,,,
2570,1,我让周围人感受到希望与幸福。,#VALUE!,上轮回流,"['自信', '人际交往', '成为英雄']",不放'情感疗愈'和'治愈之旅'标签，因为该语句没有体现情感修复或疗愈的主题；不放'平和心境'标签，因为该语句没有直接表达情绪调节或内心安宁；不放'自我关怀'标签，因为该语句强调的是让周围人感受到希望与幸福，没有涉及到个人的自我照顾。不放'个人成长'标签，因为该语句虽暗含个人能量的传递对社会群体的影响，但不直接涉及个人成长的语境。,"['正在恋爱', '单身但准备好了开始新的恋情']",这句话体现了个人对周围人的积极影响，'我让周围人感受到希望与幸福'传递了正面的心态。根据描述，它适合'正在恋爱'的人群，因为他们会希望给伴侣带来这种感觉；同时也适合'单身但准备好了开始新的恋情'的人群，因为他们期望在未来的恋爱中发挥这种影响力。'最近刚分手'和'处在一段艰难的亲密关系中'的情况不太符合，因为这些情况更多关注于个人的情感处理和个人的感情困扰，而不是对周围人的影响。'快乐地单身着'的人可能会关注自己的幸福感，而不是影响他人，所以这个标签不包括在内。而'有点辛苦的暗恋'情况下，个人的焦点可能更多放在个人的情感体验上，而不是外向的影响和幸福传播，所以这个标签同样不适用。,['很好'],['自己'],自我肯定语 '我让周围人感受到希望与幸福' 传递出的是正面的自我认同和积极影响他人的情感，因此不适合 '不好' 和 '糟糕' 的情感状态。,,,,,,
486,1,我接受自己的不确定感，它将引导我成长。,否,0203-3,"['情感疗愈', '治愈之旅', '个人成长']",不放'自信'是因为自我肯定语未直接涉及自我肯定、力量感的增强；不放'平和心境'是因为这里更多强调成长而非平和、安宁的情绪状态；不放'人际交往'是因为语义未涉及与他人互动、关系建立；不放'自我关怀'是因为这里更侧重接纳自我而非自我照顾和生活平衡。,"['快乐地单身着', '单身但准备好了开始新的恋情', '最近刚分手']",该自我肯定语强调的是对不确定感的接受和引导个人成长，适用于以下情况： - '快乐地单身着': 句子涉及接受不确定性和个人成长，适合享受独处、自我成长、独立自主的单身状态的用户。 - '单身但准备好了开始新的恋情': 类似地，适用于准备拥抱新关系和变化的积极心态的用户。 - '最近刚分手': 句子有情感安抚作用，适合缓解毕业引发的迷茫与压力，也适用于刚经历分手的用户寻求疗愈和成长。 句子未直接涉及恋爱关系的维护和提升（如'正在恋爱'和'处在一段艰难的亲密关系中'），也无特定针对不确定感的人际关系建议（如'有点辛苦的暗恋'所需的勇气和主动），因此不放这些标签。,"['不好', '一般', '糟糕']","['学业', '自己']",该自我肯定语及其场景描述涉及到毕业生面临的不确定性和压力，适合推送给感到不好和糟糕的用户，因为它提到了安抚情感和目标平和化，这通常与自信和自我关怀有关，也适用于一般的情绪。,生活过渡,毕业适应,设定毕业后更平和的小目标，缓解因毕业引发的迷茫与压力,情感安抚-目标平和化,1.0,
1136,2,我敢于与众不同，不随波逐流。,是,0203-3,"['自信', '个人成长']",这个自我肯定语强调了个体在人群中的独特性和敢于与众不同的勇气，因此与“自信”和“个人成长”标签相关。它没有直接涉及情感的修复或联结，所以不适用于“情感疗愈”和“人际交往”。同样，语义中没有表现出对内心安宁的寻求或状态，所以不适用于“平和心境”。也没有涉及自我接纳或内在疗愈的内容，因此不适合“治愈之旅”。自我肯定语中也没有强调自我爱护、身心健康或生活平衡，所以不适合“自我关怀”。最后，该自我肯定语没有提及勇敢行动、宽恕他人或追求理想，因此和“成为英雄”标签也不符。,"['正在恋爱', '快乐地单身着', '单身但准备好了开始新的恋情']",这句话强调了个体的独立性和个性，所以不太适合处在一段艰难的亲密关系中和有点辛苦的暗恋的感情状况。前者更可能是在寻求关系中的稳定和和谐，而不是强调个性和独立性；后者则是处于一种依赖和追随的状态，并不强调独立性。,"['很好', '开心']",['自己'],这个自我肯定语传达了自信和力量感，鼓励用户保持独特性，不随波逐流。2级句子倾向于正面情感。因此适合推送给情感状态为【很好】和【开心】的用户。与家庭、健康、感情等因素关系不大，所以不选择这些标签。,夸夸,独特性夸夸,,,2.0,
